{
  "schema_version": "1.0",
  "artifact_id": "SPEC_AC_RETIREMENT_MANIFEST",
  "lifecycle": "migration-only",
  "legacy_root": "docs/product/increments",
  "legacy_glob": "**/*.md",
  "archive_root": "docs/archive/product-increments",
  "expected_file_count": 116,
  "legacy_path_digest": "a50147c57af08b089bf69cc3d0a7d81fd30537e8077dbac8ad3ef121cbee8b84",
  "prohibited_input_domains": ["product","engineering"],
  "sunset_conditions": [
    "\u5168\u90e8 records \u8fdb\u5165 migrated\u3001obsolete \u6216 rejected \u7ec8\u6001\u3002",
    "Manifest \u79fb\u5165 docs/archive/governance/ \u5e76\u4fdd\u6301\u53ea\u8bfb\u3002",
    "\u5220\u9664 active governance artifact route\uff0c\u4e14\u4e0d\u5f97\u4fdd\u7559\u4efb\u4f55\u4e0b\u6e38\u8f93\u5165\u4f9d\u8d56\u3002"
  ],
  "records": [
    {"old_path":"docs/product/increments/commercial-ai-provider-hardening/acceptance.md","old_id":"AC-COM-AI-001","source_kind":"acceptance","status":"grandfathered-unverified","destinations":[],"reason":"\u5c1a\u672a\u5b8c\u6210\u4ea7\u54c1\u8bed\u4e49\u5f52\u7c7b\uff0c\u4fdd\u7559\u4e3a\u8fc1\u79fb\u671f\u5386\u53f2\u4e8b\u5b9e\u5f85\u6838\u9a8c\u3002","owner":"product-manager"},
    {"old_path":"docs/product/increments/commercial-ai-provider-hardening/acceptance.md","old_id":"AC-COM-AI-002","source_kind":"acceptance","status":"grandfathered-unverified","destinations":[],"reason":"\u5c1a\u672a\u5b8c\u6210\u4ea7\u54c1\u8bed\u4e49\u5f52\u7c7b\uff0c\u4fdd\u7559\u4e3a\u8fc1\u79fb\u671f\u5386\u53f2\u4e8b\u5b9e\u5f85\u6838\u9a8c\u3002","owner":"product-manager"},
    {"old_path":"docs/product/increments/commercial-ai-provider-hardening/acceptance.md","old_id":"AC-COM-AI-003","source_kind":"acceptance","status":"grandfathered-unverified","destinations":[],"reason":"\u5c1a\u672a\u5b8c\u6210\u4ea7\u54c1\u8bed\u4e49\u5f52\u7c7b\uff0c\u4fdd\u7559\u4e3a\u8fc1\u79fb\u671f\u5386\u53f2\u4e8b\u5b9e\u5f85\u6838\u9a8c\u3002","owner":"product-manager"},
    {"old_path":"docs/product/increments/commercial-ai-provider-hardening/acceptance.md","old_id":"AC-COM-AI-004","source_kind":"acceptance","status":"grandfathered-unverified","destinations":[],"reason":"\u5c1a\u672a\u5b8c\u6210\u4ea7\u54c1\u8bed\u4e49\u5f52\u7c7b\uff0c\u4fdd\u7559\u4e3a\u8fc1\u79fb\u671f\u5386\u53f2\u4e8b\u5b9e\u5f85\u6838\u9a8c\u3002","owner":"product-manager"},
    {"old_path":"docs/product/increments/commercial-ai-provider-hardening/acceptance.md","old_id":"AC-COM-AI-005","source_kind":"acceptance","status":"grandfathered-unverified","destinations":[],"reason":"\u5c1a\u672a\u5b8c\u6210\u4ea7\u54c1\u8bed\u4e49\u5f52\u7c7b\uff0c\u4fdd\u7559\u4e3a\u8fc1\u79fb\u671f\u5386\u53f2\u4e8b\u5b9e\u5f85\u6838\u9a8c\u3002","owner":"product-manager"},
    {"old_path":"docs/product/increments/commercial-ai-provider-hardening/spec.md","old_id":"COM-AI-SPEC-001","source_kind":"spec","status":"grandfathered-unverified","destinations":[],"reason":"\u5c1a\u672a\u5b8c\u6210\u4ea7\u54c1\u8bed\u4e49\u5f52\u7c7b\uff0c\u4fdd\u7559\u4e3a\u8fc1\u79fb\u671f\u5386\u53f2\u4e8b\u5b9e\u5f85\u6838\u9a8c\u3002","owner":"product-manager"},
    {"old_path":"docs/product/increments/commercial-ai-provider-hardening/spec.md","old_id":"COM-AI-SPEC-002","source_kind":"spec","status":"grandfathered-unverified","destinations":[],"reason":"\u5c1a\u672a\u5b8c\u6210\u4ea7\u54c1\u8bed\u4e49\u5f52\u7c7b\uff0c\u4fdd\u7559\u4e3a\u8fc1\u79fb\u671f\u5386\u53f2\u4e8b\u5b9e\u5f85\u6838\u9a8c\u3002","owner":"product-manager"},
    {"old_path":"docs/product/increments/commercial-ai-provider-hardening/spec.md","old_id":"COM-AI-SPEC-003","source_kind":"spec","status":"grandfathered-unverified","destinations":[],"reason":"\u5c1a\u672a\u5b8c\u6210\u4ea7\u54c1\u8bed\u4e49\u5f52\u7c7b\uff0c\u4fdd\u7559\u4e3a\u8fc1\u79fb\u671f\u5386\u53f2\u4e8b\u5b9e\u5f85\u6838\u9a8c\u3002","owner":"product-manager"},
    {"old_path":"docs/product/increments/commercial-ai-provider-hardening/spec.md","old_id":"COM-AI-SPEC-004","source_kind":"spec","status":"grandfathered-unverified","destinations":[],"reason":"\u5c1a\u672a\u5b8c\u6210\u4ea7\u54c1\u8bed\u4e49\u5f52\u7c7b\uff0c\u4fdd\u7559\u4e3a\u8fc1\u79fb\u671f\u5386\u53f2\u4e8b\u5b9e\u5f85\u6838\u9a8c\u3002","owner":"product-manager"},
    {"old_path":"docs/product/increments/commercial-ai-provider-hardening/spec.md","old_id":"COM-AI-SPEC-005","source_kind":"spec","status":"grandfathered-unverified","destinations":[],"reason":"\u5c1a\u672a\u5b8c\u6210\u4ea7\u54c1\u8bed\u4e49\u5f52\u7c7b\uff0c\u4fdd\u7559\u4e3a\u8fc1\u79fb\u671f\u5386\u53f2\u4e8b\u5b9e\u5f85\u6838\u9a8c\u3002","owner":"product-manager"},
    {"old_path":"docs/product/increments/commercial-subscription-readiness/acceptance.md","old_id":"AC-COM-001","source_kind":"acceptance","status":"grandfathered-unverified","destinations":[],"reason":"\u5c1a\u672a\u5b8c\u6210\u4ea7\u54c1\u8bed\u4e49\u5f52\u7c7b\uff0c\u4fdd\u7559\u4e3a\u8fc1\u79fb\u671f\u5386\u53f2\u4e8b\u5b9e\u5f85\u6838\u9a8c\u3002","owner":"product-manager"},
    {"old_path":"docs/product/increments/commercial-subscription-readiness/acceptance.md","old_id":"AC-COM-002","source_kind":"acceptance","status":"grandfathered-unverified","destinations":[],"reason":"\u5c1a\u672a\u5b8c\u6210\u4ea7\u54c1\u8bed\u4e49\u5f52\u7c7b\uff0c\u4fdd\u7559\u4e3a\u8fc1\u79fb\u671f\u5386\u53f2\u4e8b\u5b9e\u5f85\u6838\u9a8c\u3002","owner":"product-manager"},
    {"old_path":"docs/product/increments/commercial-subscription-readiness/acceptance.md","old_id":"AC-COM-003","source_kind":"acceptance","status":"grandfathered-unverified","destinations":[],"reason":"\u5c1a\u672a\u5b8c\u6210\u4ea7\u54c1\u8bed\u4e49\u5f52\u7c7b\uff0c\u4fdd\u7559\u4e3a\u8fc1\u79fb\u671f\u5386\u53f2\u4e8b\u5b9e\u5f85\u6838\u9a8c\u3002","owner":"product-manager"},
    {"old_path":"docs/product/increments/commercial-subscription-readiness/acceptance.md","old_id":"AC-COM-004","source_kind":"acceptance","status":"grandfathered-unverified","destinations":[],"reason":"\u5c1a\u672a\u5b8c\u6210\u4ea7\u54c1\u8bed\u4e49\u5f52\u7c7b\uff0c\u4fdd\u7559\u4e3a\u8fc1\u79fb\u671f\u5386\u53f2\u4e8b\u5b9e\u5f85\u6838\u9a8c\u3002","owner":"product-manager"},
    {"old_path":"docs/product/increments/commercial-subscription-readiness/acceptance.md","old_id":"AC-COM-005","source_kind":"acceptance","status":"grandfathered-unverified","destinations":[],"reason":"\u5c1a\u672a\u5b8c\u6210\u4ea7\u54c1\u8bed\u4e49\u5f52\u7c7b\uff0c\u4fdd\u7559\u4e3a\u8fc1\u79fb\u671f\u5386\u53f2\u4e8b\u5b9e\u5f85\u6838\u9a8c\u3002","owner":"product-manager"},
    {"old_path":"docs/product/increments/commercial-subscription-readiness/acceptance.md","old_id":"AC-COM-006","source_kind":"acceptance","status":"grandfathered-unverified","destinations":[],"reason":"\u5c1a\u672a\u5b8c\u6210\u4ea7\u54c1\u8bed\u4e49\u5f52\u7c7b\uff0c\u4fdd\u7559\u4e3a\u8fc1\u79fb\u671f\u5386\u53f2\u4e8b\u5b9e\u5f85\u6838\u9a8c\u3002","owner":"product-manager"},
    {"old_path":"docs/product/increments/commercial-subscription-readiness/acceptance.md","old_id":"AC-COM-007","source_kind":"acceptance","status":"grandfathered-unverified","destinations":[],"reason":"\u5c1a\u672a\u5b8c\u6210\u4ea7\u54c1\u8bed\u4e49\u5f52\u7c7b\uff0c\u4fdd\u7559\u4e3a\u8fc1\u79fb\u671f\u5386\u53f2\u4e8b\u5b9e\u5f85\u6838\u9a8c\u3002","owner":"product-manager"},
    {"old_path":"docs/product/increments/commercial-subscription-readiness/acceptance.md","old_id":"AC-COM-008","source_kind":"acceptance","status":"grandfathered-unverified","destinations":[],"reason":"\u5c1a\u672a\u5b8c\u6210\u4ea7\u54c1\u8bed\u4e49\u5f52\u7c7b\uff0c\u4fdd\u7559\u4e3a\u8fc1\u79fb\u671f\u5386\u53f2\u4e8b\u5b9e\u5f85\u6838\u9a8c\u3002","owner":"product-manager"},
    {"old_path":"docs/product/increments/commercial-subscription-readiness/acceptance.md","old_id":"AC-COM-009","source_kind":"acceptance","status":"grandfathered-unverified","destinations":[],"reason":"\u5c1a\u672a\u5b8c\u6210\u4ea7\u54c1\u8bed\u4e49\u5f52\u7c7b\uff0c\u4fdd\u7559\u4e3a\u8fc1\u79fb\u671f\u5386\u53f2\u4e8b\u5b9e\u5f85\u6838\u9a8c\u3002","owner":"product-manager"},
    {"old_path":"docs/product/increments/commercial-subscription-readiness/acceptance.md","old_id":"AC-COM-010","source_kind":"acceptance","status":"grandfathered-unverified","destinations":[],"reason":"\u5c1a\u672a\u5b8c\u6210\u4ea7\u54c1\u8bed\u4e49\u5f52\u7c7b\uff0c\u4fdd\u7559\u4e3a\u8fc1\u79fb\u671f\u5386\u53f2\u4e8b\u5b9e\u5f85\u6838\u9a8c\u3002","owner":"product-manager"},
    {"old_path":"docs/product/increments/commercial-subscription-readiness/acceptance.md","old_id":"AC-COM-011","source_kind":"acceptance","status":"grandfathered-unverified","destinations":[],"reason":"\u5c1a\u672a\u5b8c\u6210\u4ea7\u54c1\u8bed\u4e49\u5f52\u7c7b\uff0c\u4fdd\u7559\u4e3a\u8fc1\u79fb\u671f\u5386\u53f2\u4e8b\u5b9e\u5f85\u6838\u9a8c\u3002","owner":"product-manager"},
    {"old_path":"docs/product/increments/commercial-subscription-readiness/acceptance.md","old_id":"AC-COM-012","source_kind":"acceptance","status":"grandfathered-unverified","destinations":[],"reason":"\u5c1a\u672a\u5b8c\u6210\u4ea7\u54c1\u8bed\u4e49\u5f52\u7c7b\uff0c\u4fdd\u7559\u4e3a\u8fc1\u79fb\u671f\u5386\u53f2\u4e8b\u5b9e\u5f85\u6838\u9a8c\u3002","owner":"product-manager"},
    {"old_path":"docs/product/increments/commercial-subscription-readiness/acceptance.md","old_id":"AC-COM-013","source_kind":"acceptance","status":"grandfathered-unverified","destinations":[],"reason":"\u5c1a\u672a\u5b8c\u6210\u4ea7\u54c1\u8bed\u4e49\u5f52\u7c7b\uff0c\u4fdd\u7559\u4e3a\u8fc1\u79fb\u671f\u5386\u53f2\u4e8b\u5b9e\u5f85\u6838\u9a8c\u3002","owner":"product-manager"},
    {"old_path":"docs/product/increments/commercial-subscription-readiness/acceptance.md","old_id":"AC-COM-014","source_kind":"acceptance","status":"grandfathered-unverified","destinations":[],"reason":"\u5c1a\u672a\u5b8c\u6210\u4ea7\u54c1\u8bed\u4e49\u5f52\u7c7b\uff0c\u4fdd\u7559\u4e3a\u8fc1\u79fb\u671f\u5386\u53f2\u4e8b\u5b9e\u5f85\u6838\u9a8c\u3002","owner":"product-manager"},